,Bintang,Pengguna,Komen,Tanggal
0,Rated 5 stars out of five stars,Briliandaru M Pribadi,"Nice apps. It's very helpful, especially when I don't have time to buy groceries and meat in supermarket.","February 24, 2020"
1,Rated 5 stars out of five stars,Élise Faulkner,"Great price and lots of promo. App is also very straightforward and easy to use. The brand itself is very responsible and has great customer service handling, very impressive!","February 14, 2020"
2,Rated 5 stars out of five stars,Tania Anggraini,"Easy to buy, simple, Fresh quality, Excellent Packing, Good Price, Excellent Service Delivery.","February 20, 2020"
3,Rated 1 stars out of five stars,elf _ycel,"You have a lot of foreigners in Indonesia, please consider having an option on the app to be in ENGLISH language so it is easier to understand what you are selling and how to order! It will ve a big help! Thank you.","February 16, 2020"
4,Rated 5 stars out of five stars,J,Helpful app. The veggie & fruits are always fresh. Keep up the quality👍,"February 23, 2020"
5,Rated 4 stars out of five stars,Carolina Susanto,Great application. User friendly but so metimes application turn off by itself.,"February 3, 2020"
6,Rated 2 stars out of five stars,Nani Naafilah,"it said network error, my wifi is just fine. I cannot search for vegetables and fruits i wanted","February 19, 2020"
7,Rated 4 stars out of five stars,Lalitya Anindita,"It's a helpfull app, but it needs more improvement for the search options","February 7, 2020"
8,Rated 5 stars out of five stars,Robmais,"No plastic packaging, cheap and fast.","February 18, 2020"
9,Rated 5 stars out of five stars,Natalia Lee,"It's March 2020. So far I have tried some groceries apps, it's not perfect but I can tell sayur box is the best. I had my second order, overall I am satisfied with the products, the price, the delivery and the customer service.","March 1, 2020"
10,Rated 4 stars out of five stars,Taufik Haryanto,"Nice and helpful apps with simple UI. Some inputs : 1. Adding filter feature will be helpful. For example we need to filter fruit by category: ""Organic"", and also ""source of vitamin D"", and ""high fat"" then it may result Avocado (I don't kniwnif it is correct or not, just example) which farmed in org...
Full Review","January 21, 2020"
11,Rated 5 stars out of five stars,Samuel Kurniawan,"Free delivery, fresh fruits and vegetables","February 15, 2020"
12,Rated 4 stars out of five stars,Anggi Ag,Nice app..easy n simple to order,"February 23, 2020"
13,Rated 5 stars out of five stars,Yunanto Purnomo,"Good packaging,fast delivery,affordable price compared to supermarket,and the most important : fruits quality is satisfying..definitely order again","January 26, 2020"
14,Rated 5 stars out of five stars,Lidya Fransisca,Sayur box give the best quality for every fruit And all vegetable is always fresh,"March 1, 2020"
15,Rated 5 stars out of five stars,Vereline Lee,"Great apps, recommended to other user! My order has been delivered on time with the freshness of vegetables and fruits.. Easy to use and great value, busy mother like me need no worries to provide daily food for my family.. Thanks to sayurbox!","December 18, 2019"
16,Rated 4 stars out of five stars,RiniR _,such a good and helpful app. The price is better than a competitor app. All products are fresh and the delivery was on time. Keep it up,"December 17, 2019"
17,Rated 5 stars out of five stars,Purwani Febriyanti,"Great apps !! So helpfull to find groceries without leaving home, please add more meat, fish and protein. Keep it up !!!","December 27, 2019"
18,Rated 5 stars out of five stars,Omar A,"Good quality of product, always satisfied. Variants of fruits and vegetables are the best.","December 28, 2019"
19,Rated 5 stars out of five stars,arlista putri,"Easy apps, a lot of promo, the messenger are kind, valuable price, and absolutely plasticless","January 22, 2020"
20,Rated 2 stars out of five stars,Maylisa Putri,There a problem with the app.. The app immediately closes when i press a feature or search for something.,"December 14, 2019"
21,Rated 5 stars out of five stars,Firstari Vashti,A new way to restock the fridge without leaving the house. Very helpful. App works very well. The chat feature also works well. The costumers service respond to the chat quickly.,"November 15, 2019"
22,Rated 5 stars out of five stars,Zakia Syifa,Very convenient! Suitable for working households who like to come home late and no time for grocery shopping!,"December 18, 2019"
23,Rated 1 stars out of five stars,Felisia F,Always network error Even I have good signal and switched to my mobile data. What does the matter?,"January 16, 2020"
24,Rated 5 stars out of five stars,Surya Baskara,"It was worked, I got my package in two days, even though I've just order promotion items, thank you sayurbox, it was very helpful","January 28, 2020"
25,Rated 5 stars out of five stars,dede setianingsih,"Fast delivery, cheaper than supermarket, and the important thing is the vegetables is very good condition. Thanks","December 28, 2019"
26,Rated 5 stars out of five stars,Winda Ayu,So helpful apps that bring real food for everyone with the best price! Love your promos! ♥️,"January 5, 2020"
27,Rated 5 stars out of five stars,Irine Natalia,"Good app to buy groceries, I get lots of promo here and the price is cheap. Suggestion: should add more meat selection, and some UI elements are slow when clicked.","December 5, 2019"
28,Rated 1 stars out of five stars,Sundari Ika Binarti Ika,Not all the fruits n vegetables are fresh and good,"February 11, 2020"
29,Rated 5 stars out of five stars,Niena Khotimah,It's very easy to use. And very convinence to order veggies and fruit with this app. Love it!,"October 31, 2019"
30,Rated 5 stars out of five stars,Vina Ikawati Agustin,This apps really helps me to buy fruits when im just too lazy to go out to supermarket or to a market. Thankyou sayurbox ❤,"February 17, 2020"
31,Rated 5 stars out of five stars,Clarissa Irene,"Good veggies and fruits, with convenient delivery method. Love it!","October 31, 2019"
32,Rated 5 stars out of five stars,Jenie Kesuma,"Service ok, akan repeat order","March 8, 2020"
33,Rated 1 stars out of five stars,Mustika D Ratnaningrum,"Whenever i push the chekout button, the app is always suddenly closed. So until now i cant't buy anything. Pls fix this. I use samsung A9 2018 btw","November 19, 2019"
34,Rated 2 stars out of five stars,leadsin99er,"Sometimes packaging is bad. Vegetables arrive wet inside plastic. It Rots when it's supposed to be wrapped in paper. Sometimes quality of fruits amd veges arent gd. Esp the discounted ones. Also. quite a few missing items AFTER u paid for ur order. u dont get a refund but a voucher. They have too li...
Full Review","December 13, 2019"
35,Rated 5 stars out of five stars,Nurul Habibah,Very good app for simple person its easy to use. good quality product. Thank you,"November 11, 2019"
36,Rated 5 stars out of five stars,SWASTIKAYEYOO,"It is such a good aplication.. So helpful and the price is make me happy to shop here.. Thankyou.. Keep improving yourself, sayur box!! 😁","November 25, 2019"
37,Rated 5 stars out of five stars,Mariani Dewi,Fast delivery. Considerably reliable product quality.,"December 17, 2019"
38,Rated 5 stars out of five stars,anis kamilah,"Very easy and helpful apps, I just wish they will expand the delivery area...","October 29, 2019"
39,Rated 5 stars out of five stars,nana nury,"Great service, fresh fruits and veggies and the price as affordable as in the traditional market","December 10, 2019"
40,Rated 5 stars out of five stars,Beni Ananto,Sayurbox helps me easier for shopping vegetables and fruits.,"December 24, 2019"
41,Rated 5 stars out of five stars,C Stmrg,Good app and easy to use. Very convenient,"November 23, 2019"
42,Rated 5 stars out of five stars,alexandra veranika,The application is easy to use. Love it ! 😊👍,"December 22, 2019"
43,Rated 5 stars out of five stars,Muhammad Khalid,"Easy way to order fresh produce, farm to table!","November 21, 2019"
44,Rated 1 stars out of five stars,Elia Cokorudy,"I installed this app based on a recommendation of a friend but I was extremely disappointed on my first experience. I received moldy grape & I did not receive an item which I paid already. I emailed the customer care but did not get any response. I texted the customer care through the app, they aske...
Full Review","January 5, 2020"
45,Rated 5 stars out of five stars,Arlene Awuy,Helpful apps to buy healthy veggies for your needs,"November 5, 2019"
46,Rated 5 stars out of five stars,Panca Nugraha Wulansari,Good service..fast delivery and fresh vegetable 👍👍👍👍,"October 26, 2019"
47,Rated 5 stars out of five stars,Wully Ramadhani,Good quality of product n easy application to use,"November 25, 2019"
48,Rated 5 stars out of five stars,venissa cuputra,Very good and usefull,"March 5, 2020"
49,Rated 1 stars out of five stars,Sindhu Subramanya,Please chk ur app. Not able to do anything. The review screen keeps poping for everything.,"December 11, 2019"
50,Rated 5 stars out of five stars,Melisa Andriani,Great! Helpful service,"February 23, 2020"
51,Rated 4 stars out of five stars,Diana S,"1 of my order stuck in progress, cant end","February 29, 2020"
52,Rated 4 stars out of five stars,Yusuf Rahmadi,Should have a feature which user can save their address instead always typing in every order,"November 28, 2019"
53,Rated 4 stars out of five stars,ridha ikhsan,The shopping system is good,"December 23, 2019"
54,Rated 5 stars out of five stars,Rakesh Sharma,Delivery is great. On time. Quality is good. And Prices are very reasonable.,"December 30, 2019"
55,Rated 5 stars out of five stars,Eva Andreanty,"Easy for buy vegetables and fruits .... and good quality 👍👍👍, the aplication user friendly but please give us the more more others item for fruits and vegetable. Thanks Sayurbox..... you help my family for buying all we are need.","November 4, 2019"
56,Rated 5 stars out of five stars,Jones Ordinary,"I really love it, the apps, the service.. no doubt","December 11, 2019"
57,Rated 5 stars out of five stars,eduardgoody,"A practical and easy way to shop for groceries. decent amount of choices of items with fair pricing. They also have a ""Less Plastic"" delivery option, which comes in a paper bag. Although, the content still have a few plastic (e.g. bubble wrap), but it is understandable. The delivery is spot on. Over...
Full Review","September 17, 2019"
58,Rated 5 stars out of five stars,theresia butarbutar,It's help a lot for person who is rare go to supermarket.,"January 4, 2020"
59,Rated 4 stars out of five stars,Muli Muljati,Always got refund bcs of unfulfilled items,"February 20, 2020"
60,Rated 5 stars out of five stars,Moe A.,grear convenient app for fresh veggies,"December 28, 2019"
61,Rated 5 stars out of five stars,Sylviana V Sundoro,Fress veggies and fruits to my door aaannnddd good value of money! Love it!,"December 17, 2019"
62,Rated 5 stars out of five stars,sri tutio,Very helpfull application,"February 26, 2020"
63,Rated 5 stars out of five stars,Lailani Ananda Putri,Good apps...great vegie n fruits...satisfied...thanks..,"January 8, 2020"
64,Rated 5 stars out of five stars,Savira Vira,"Dear Sayurbox, The application in the App store is very friendly to use, we can easily check the goods and order them efficiently. But sometimes when you go to the special promo tab, it can be pending for a few minutes and sometimes cannot open the tab. So far, I'm very helpful with sayurbox, the fr...
Full Review","March 25, 2019"
65,Rated 5 stars out of five stars,Mutia Kurniasari,One of the most trusted shop for fresh product 👍,"December 25, 2019"
66,Rated 5 stars out of five stars,Syakiroh Syauqi,"I'm waiting for payment method at this app using VA BNI Syariah or BNI Syariah transfer Bank. Well, I support it's useful apps where we can find an organic food and without plastic packaging... Always steadfast in your innovation","October 4, 2019"
67,Rated 5 stars out of five stars,Gilang Permatasari,"Nice app, nice quality. Thanks","January 26, 2020"
68,Rated 5 stars out of five stars,Riska Rahmayanti,"Fast delivery,,good packaging n product,,","November 23, 2019"
69,Rated 5 stars out of five stars,Fahmi R A,"Very useful, competitive price, on time delivery, and good fruits, vegetables","September 22, 2019"
70,Rated 5 stars out of five stars,Rhendy Caesar,"Great app, make it easy to but fruits and veggies. Stuff are fresh, good one! Sekarang jd rajin makan buah dan sayuuurr, makaaasih sayurbox!","September 13, 2019"
71,Rated 5 stars out of five stars,Angelita Palisoc,Very useful app especially for those people who wants to adopt a healthier lifestyle. All freshly delivered to your home. Loved it!,"September 16, 2019"
72,Rated 2 stars out of five stars,Rama Tri Antono,"They REALLY REALLY REALLY need to work on the apps. it doesn't work, it kept reloading every time i open it, spoke with their customer service but no improvement whatsoever until today. hope they sort this issue at the soonest, cos it gave unpleasant experience","May 29, 2019"
73,Rated 5 stars out of five stars,diana kusuma,Br pertama kl coba beli nih. Great deal.easy used app,"October 29, 2019"
74,Rated 5 stars out of five stars,Unch Things,"Fresh and affordable products. I can live a healthy life from now on Buttt, the app is a little bit suck. I cannot use it using community network wifi.","November 6, 2019"
75,Rated 5 stars out of five stars,Widya,"The app works properly and easy to use. Helping me to get super fresh fruits n vegetables with good quality, good price, and on time. Appreciated the packing. It use paper instead of plastic.","March 9, 2019"
76,Rated 3 stars out of five stars,Azzam Al Hadiq,"app quite good, transaction was success, and delivery as expected, but ui/ux can be improved, for example when completing address, the province option cannot being change except from the calendar option its give hassle for me. and some text on button, report, etc was buggy, i cannot see. on android ...
Full Review","August 17, 2019"
77,Rated 5 stars out of five stars,Alfi Azizah,Best and easiest way to get your needs in front of your door. Fresh veggies and fruits. Great package. Friendly customer services and couriers. Comfy-looking apps for shopping.,"November 8, 2019"
78,Rated 5 stars out of five stars,Ni Putu Saraswati Vradisca,"one word. AMAZING. very easy, lot of discount (yes!i love discount!!), all the information and instructions are very clear, the app's design is very neat. i just love it, keep up the good work!","July 24, 2019"
79,Rated 5 stars out of five stars,siti ismawati idris,"first time using this kind of application and it have all i need, really easy to use and pay, and deliveries on time and more important is the vegetables/fruits/packaging is in fresh condition.","March 21, 2019"
80,Rated 4 stars out of five stars,T W,"This app really helps me to live a healthier lifestyle, I can order fruits and get them delivered to my home. Sometimes the promo doesn't open no matter how long it loads. Need to fix this.","April 28, 2019"
81,Rated 5 stars out of five stars,sharfina justicia,"Very helpful for busy workers that want to stay healthy. The best is, its super efficient, just click and voila! Your groceries is arrived at your place the next day. Super quick and easy","September 12, 2019"
82,Rated 5 stars out of five stars,mellyana lim,Love this application.Always delivery fresh fruits and vegetables.,"October 19, 2019"
83,Rated 5 stars out of five stars,Toni Pegipegi,Super convenient! All the instruction is very helpful. I never imagined that buying groceries could be this seamless. There are also many promos!!,"September 12, 2019"
84,Rated 5 stars out of five stars,Rosevin Aquinaldi,Friendly user and quite various vegie and fruit . Really usefully for working mother like me 👍😁,"December 8, 2019"
85,Rated 1 stars out of five stars,Aki Baihaki,"Fundamental issue is inconsistent base measurements. sometimes the price is per kg, 1/2 kg, some grams. Confusing (and cheating marketing tactics?) and if this app cannot go international because in some country it's against the law to not follow standard base measurement.","July 6, 2019"
86,Rated 5 stars out of five stars,mulyara,"Good application, easy to navigate, fast","October 12, 2019"
87,Rated 5 stars out of five stars,wismi nurisdiani,"Helpfully apps for working wife/mom. Safe energy, and time. Makes all thing simple","November 3, 2019"
88,Rated 5 stars out of five stars,Ve Ll,great product. affordable price and fast delivery!,"October 4, 2019"
89,Rated 5 stars out of five stars,Nirwanto Maingkolang,Fresh! Happy to help local farmers.,"December 13, 2019"
90,Rated 5 stars out of five stars,ZeKKe Games,"Please add Central Java because I really need this app, thank you","November 14, 2019"
91,Rated 5 stars out of five stars,mia puspita,Very nice app easy to use..i like it,"November 21, 2019"
92,Rated 1 stars out of five stars,Diajeng Ayu,I cannot order anything because the apps always closed suddenly,"November 30, 2019"
93,Rated 5 stars out of five stars,masagus ridwan,I love sayurbox. Very user friendly,"January 10, 2020"
94,Rated 5 stars out of five stars,ayu pratiwi,Have been using this app a few times now to do my groceries. Never been disappointed!,"September 20, 2019"
95,Rated 5 stars out of five stars,Elvina Kurniawati,this application makes it very easy for me to get used to a healthy life and buying the best quality vegetables and fruits,"March 25, 2019"
96,Rated 2 stars out of five stars,Reinaldo Gunawan,please provide re-order feature and allow option to cancel entire order if any product is missing instead of giving store credit for missing item(s). i will give 5 stars once these features are deployed. thanks.,"June 20, 2019"
97,Rated 5 stars out of five stars,Shiv kumar Garg,"Good app speciallt for certain item you cant find in pasar can find here, need to add more fruits like apple and other","September 16, 2019"
98,Rated 5 stars out of five stars,Syahrina Pahlevi,One of the best groceries. So easy and always on time.,"October 2, 2019"
99,Rated 5 stars out of five stars,Qurratu Aini Firdausi,"Nice UI, great quality product, and has pretty wide selection of items.","August 25, 2019"
100,Rated 5 stars out of five stars,Nurul Hanifa,"Very recommended!! Sayurbox always deliver fresh vegetables & fruits Very helpful especially for workers who want to consume fruits and vegetables for healthy living, many promos and free shipping without having to bother spending time to shopping and carrying groceries.","March 25, 2019"
101,Rated 5 stars out of five stars,Bena Gannie,"Great service , on time delivery n for sure fresh veggies n fresh fruits...","September 28, 2019"
102,Rated 5 stars out of five stars,Ajeng Ghina Farhani,"Easy to use,lots of different payment options, having option to have your products packaged without plastic.","July 25, 2019"
103,Rated 5 stars out of five stars,ODD Journey and diary,Always satisfied with their services. Helpful apps so far. Keep up the good work.,"March 12, 2019"
104,Rated 5 stars out of five stars,Arif Zamani,"Good apps, easy to use and love the quality of fruits and vegies here","November 14, 2019"
105,Rated 5 stars out of five stars,Marcelia Femi,love this application. make me easier to buy fruits and veggie without going to supermarket. the price are good too. thanks.,"July 20, 2019"
106,Rated 1 stars out of five stars,Simon S,cannot input address for checking out. very frustating. i followed the example of address writing instructed but still nothing changed,"September 9, 2019"
107,Rated 5 stars out of five stars,Adiyani Rahmanulia,Love the service and also the product from sayurbox... Note that the CS from app have fast response....... will repeat the order from this Sayurbox...,"October 20, 2019"
108,Rated 1 stars out of five stars,Rolis,Mulia sekali misinya memberdayakan petani... Too good to be true,"November 13, 2019"
109,Rated 2 stars out of five stars,Chyntia Leola,Can't search or choose the food,"January 16, 2020"
110,Rated 5 stars out of five stars,Christina P,very useful apps. Sayurbox makes shopping fruit and vegetables easier.,"March 26, 2019"
111,Rated 1 stars out of five stars,annanovalia dewii,"I've ordered and finished the payment on sunday, The order should be delivered on tuesday at 06-09 AM.. Well, Its already at 1 PM and my order hast delivered until now. Bad system, bad services and no option to do. Refund. No tracking order either. What an experiences to order in here.","February 4, 2020"
112,Rated 5 stars out of five stars,Dwi Ajeng Zahrotun Noor,top quality. always get fresh tempe. it still warm when they sent. keep up good work:),"July 24, 2019"
113,Rated 5 stars out of five stars,Lenny Tan,easy to use. pengantaran barang jg tepat waktu. good app :),"September 14, 2019"
114,Rated 5 stars out of five stars,santy,"super easy to apply, nice packaging, good choice of vegetable, good price","May 1, 2019"
115,Rated 5 stars out of five stars,ike herningtyas,"first order and satisfied. delivery on schedule, and the products are fresh.","July 12, 2019"
116,Rated 5 stars out of five stars,Maria M. Dolorosa Farah Diena,"I like the concept behind it very much. There's not that many options here to be able and apply farm-to-table. I had an issue regarding delivery the first time, but I decided to give it a second chance and they made it up! the produce is complete fresh, the price is highly competitive and I love tha...
Full Review","July 27, 2019"
117,Rated 5 stars out of five stars,Karinina Putri,"Good local quality fresh produce. Easy payment and attentive customer service. Fruits could use more variety. Could also start thinking about reducing/substituting plastic altogether for some customers (like me!). Substitute paper bags for nylon nets, leftover cardboard for styrofoam, cotton strings...
Full Review","September 30, 2019"
118,Rated 3 stars out of five stars,Tanthrie Julia,"the service is ok but poor application, loading and does work, i lazy to use this app because of very difficult to load fruit or vegetable.. please fix the apps","April 8, 2019"
119,Rated 1 stars out of five stars,alvin reinanda,Useless. Loading never ending. Love the products and promos but the app is wrost..,"May 30, 2019"
120,Rated 5 stars out of five stars,Ricks Flanel,Rocking app for grocery shopping,"November 16, 2019"
121,Rated 5 stars out of five stars,Widya Adi Tjahjono,Fast and helping us to get vegetables,"November 30, 2019"
122,Rated 3 stars out of five stars,A Google user,The old version was working fine. New version is lagging,"November 13, 2018"
123,Rated 5 stars out of five stars,Vidyani Ratna,Amazing fresh fruits and not pricey. Great job! 😊😊👍,"March 6, 2020"
124,Rated 5 stars out of five stars,Susanti Lien,the products are fresh and with reasonable price..,"March 27, 2019"
125,Rated 5 stars out of five stars,Raven Winguard,"Very affordable veggies and fruit! Though quality is not the best, but they are fresh and buying feom them helps local farmers tons!!","September 2, 2019"
126,Rated 5 stars out of five stars,Ritu ranjan,Fresh veggies with Nice packing....love to order again and again,"October 7, 2019"
127,Rated 5 stars out of five stars,Ima Ananda,Freshness at our door everyday. Wow! Thank you sayurbox.,"December 4, 2019"
128,Rated 5 stars out of five stars,Dwi Budiarti,It helps me a lot for my fresh groceries...Good quality product help the community and not to forget excellent service...,"September 13, 2019"
129,Rated 5 stars out of five stars,amy putri,"On time delivery, fresh products on fruits and veggies, great prices, good packaging. Definitely reorder!!","August 17, 2019"
130,Rated 1 stars out of five stars,Aimee Huang,"Hi the quality of the vegetables drop significantly, the mushrooms are rotting and the kangkung i bought today are all yellowish, used to be not like this but slowly detoriating. What happened?","December 27, 2019"
131,Rated 5 stars out of five stars,Indra Nugraha,"Good services, reliable and ontime.","October 3, 2019"
132,Rated 5 stars out of five stars,Dyan Oktavia Rindhu Shinta R.,"user friendly, simple, usefull, fresh item","March 29, 2019"
133,Rated 4 stars out of five stars,Irma Martam,sometimes it is very slow to open the page,"April 1, 2019"
134,Rated 5 stars out of five stars,Feby Indriyani,"it is a great apps for working women. fresh veggies fruits, plenty of choice,fast delivery","March 26, 2019"
135,Rated 5 stars out of five stars,astrid siska,Great apps..thanks👍😊,"December 14, 2019"
136,Rated 5 stars out of five stars,Rahmi Kurnia Sari,"Very helpful for everyone, farmer and customer, super recommended!","September 8, 2019"
137,Rated 5 stars out of five stars,Rafieza Roslan,Sayurbox is a good app where I can bought fresh vegetables and fruits. Very recommended.,"April 8, 2019"
138,Rated 5 stars out of five stars,Nilesh Kumar,"Good, fresh fruits and vegetables. Easy ordering and delivery experience. Keep it up!","August 28, 2019"
139,Rated 5 stars out of five stars,rani amas,"Make grocery shopping easier! Few taps only and your order will be delivered asap! (there're 3 days delivery choices) Have some bad experience/(unfortunately)bad groceries? No worries! tell them via email/ig/whatsapp, soon you will get not only a nice response but also shopping voucher as a return, ...
Full Review","March 17, 2019"
140,Rated 5 stars out of five stars,Rizky Nurkhaerani,Good product good service,"November 10, 2019"
141,Rated 5 stars out of five stars,Rohani Sinambela,Great app. Fast and secure,"September 12, 2019"
142,Rated 5 stars out of five stars,Syenit Enita,"Very helping, no plastic package, i love it!","September 8, 2019"
